コース名,クラス名,講師名,講座タイトル,対象年齢,内容,感想（一部）,該当URL
心・からだ・知育のびのびコース,-,三橋かな,ハーバード流！能力に差をつける読み聞かせ講座,0～6歳,"絵本は新しい語彙や表現を教える
最高の教材になります。

今回は、ダイヤロジックリーディングという手法を使い

言葉の発達だけでなく、
伝える力や思考力、読解力をはじめとする社会を生き
抜いていくための基礎力となる能力を育むための
ポイントをお伝えします✨","・絵本の読み聞かせはどの子育て情報でも推奨されているので完璧な物だとイメージしていたので驚きでした。確かに一方的なコミュニケーションになりがちですね。絵本はプロが作ったものなので一字一句同じように読むようにといった意見も聞いた事がありましたが、講義をお聞きして双方向のコミュニケーションの発達という点も意識したいと思います。
・ダイアログリーディングを初めて知りました。「PEERという順序に沿って行われる、今までそんなことを考えて読み聞かせしたことがありません。日本は心の面を重視しますが、アメリカでは学習面で絵本を活用すると初めて知り、国によって全然違うのだなと思いました。",https://fants.jp/feeds/846031?openExternalBrowser=1
心・からだ・知育のびのびコース,おうちモンテクラス,菅原りょうこ,"意図して伸ばせる学力/非認知能力
テーマ「学力も自己肯定感も上がる褒め方",0～6歳,"非認知能力って、なんですか？って聞かれたらなんてこたえる？
遊び？自由？コミュ力？自己肯定感？
子どもの学力と、非認知能力は一緒に伸びるし、意図して伸ばすことができます。
ただ、ほとんどが家庭から伸びていきます。
そのコツと、お家でできることを紹介します。

【いただいたご質問】
・ゆくゆくの集団生活や学びにつながる力として、好奇心を満たしながらも自制できるようになる関わり方や工夫があれば知りたい
・そもそも非認知能力とはなにか、なぜそこにフォーカスを当てて伸ばす必要があるのか、りょうこ先生のご意見を伺ってみたい
・保育園で、先生に「製作やる？」と聞かれても、他の遊びに夢中だと「やらない！」と言い、クラスで一人だけ製作せず作品もないことがある。家ではさらに自由奔放で、本人の気が済むまでやらせないとギャン泣き・暴れる。保育園ならまだ許されても、小学校に上がったらそうはいかないのでは…と不安。このようなタイプの子にも非認知能力は備わっているものなのか","・バズワードっぽくて、中身がよくわからなかった「非認知能力」について、目の前にあるものと言葉・概念を結びつけていく力を育てることだと解釈しました。
さんまと秋がつながらない、スキーと冬がつながらないといった事例がとても印象的でした。同時に、バナナ一つとっても、子どもと一緒に想像できること、学べることはたくさんあるなと再認識できました。
子どもと一緒に季節を感じること、日常のモノ・コトの背景を知ることを大事にしたいと思っていましたが、改めて実践していきたいと思いました。",https://fants.jp/feeds/852209?openExternalBrowser=1
心・からだ・知育のびのびコース,モリモリごはんクラス,ももマミー,もりもりごはんクラス　8月の質問回答ライブ,0～2歳,"【いただいたご質問】
・完了期から幼児食への移行
・食べない子の卒乳について
・離乳食中の姿勢について
・ミラクルカップの使用について
・体調不良時の食事について
・食べないものが多くなり困っています","・似た月齢の方の質問が多くためになりました。
質問への回答もありがとうございます。気が散っているというよりは、ダメな時は一切口を開けたがりません…でも口に入ったらちゃんと飲み込むか、いったんモグモグして出します。嫌いなものを出されるのはいいのですが口を開けてくれないと何も始まらず悩んでおりました。。。
とりあえずまだ卒ミはしなくていいとのお答えだったので少し気が楽になりました。私自身も小さい頃はなかなか食べなかったらしいので、気長に付き合うことにしようと思います。食べないなりにも数ヶ月前に比べたら食べられる量は増えていますしね。また来月も楽しみにしています‼︎",https://fants.jp/feeds/854535?openExternalBrowser=1
心・からだ・知育のびのびコース,発達あそびクラス,かなこ,トイレットペーパーの芯で紙飛行機を作って遊ぼう！,0～6歳,"6月のクラスでのアンケートでのご要望にお答えして、どの家庭でも出るトイレットペーパーの芯を再利用して、紙飛行機を作ってみたいと思います。
それを使って発達運動あそびをやってみましょう！

家にあるものでも色んな遊び方があります。それが発達に良い事ならよりやりたくなりますよね。暑いからこそそんなおうち遊びをご提案します🎶","・飛行機を投げる動作は細分化するとたくさんの動作になるというのが改めて分かりました。
うちの子投げるのがイマイチ下手だなぁと思っていても、どうしたら良くなるのか、どうやって教えるのか全然分かっていなかったので、どこができてて、どこがもう一歩なのかよく観察してみようと思います！
・まだ子供が小さいので、できることは少ないですが、月齢に合わせたアレンジも教えてもらえたのですぐに実践できそうでした。",https://fants.jp/feeds/856807?openExternalBrowser=1
心・からだ・知育のびのびコース,おやこ英語クラス,MEInternational,Colors,0～6歳,「色」はどこにでもある！色を学べる英語の表現、絵本や歌をやります♪,"・アメリカに住んでいて子どもも英語を主に話すため必要ないかなと思っていたのですが、4歳の娘が日本語の学校に行きたいと言い出したため、他の言語を学ぶ時にやることとして参考になるのかなと思い、アーカイブで見ました。
彼女がこれまでに英語を習得してきたことを日本語でやるしかないんだなと改めて感じたのですが、英語もフォニックスが重要なように、あを見て、あと言えるようになるにはゆっくり時間をかけていかないといけないんだと実感しました。
日本に住むことはないだろうし、日本語を真剣に学ぶ必要性はないのですが、本人が興味を示しているからこそ、少しでも手助けになるようなことをしてあげたいと思います。",https://fants.jp/feeds/871065?openExternalBrowser=1
心・からだ・知育のびのびコース,知育あそびクラス,ともか,フィギュア,0～6歳,"実はごっこ遊び以外にも、知育の種がたくさんあるのが動物のフィギュア。
動物フィギュアをメインに、
・どんな遊びに使える？
・なんて声かけする？　など
講座後すぐにできることをお伝えします。","・フィギュア正直月齢的に早いかなあと思っていましたが、見ること、動くものに興味が出てきている今だからこそ良いというのが分かりました！家で遊ぶレパートリーに少し限界を感じていたので新しいことを増やしてみようと思えました！
・フィギュアはごっこ遊びしか遊び方が無いと思い込んでいたので、目からウロコでした。マステや氷と併用したりこれまでのクラスともつながっていて意外にコスパ良いかもと思いました。同じ子育てママとしてコスパ重視で教えてくださるのはとてもありがたいです笑
モンテッソーリとか高いイメージだったので…
私もメルカリでさっそく探してみようと思います‼︎",https://fants.jp/feeds/880338?openExternalBrowser=1
心・からだ・知育のびのびコース,おうちモンテクラス,菅原りょうこ,"自己肯定感に繋がるのは１つだけ。
世界一カンタンな子どものいいところを褒める方法",0～6歳,"叱ると、自己肯定感が育たない？
褒めていたら、やる気のあるいい子に育つ？
どちらも正しいようで、実は違っています。
子どもが「本当に褒められた気持ちになる」褒め方と、そのために今どこを褒めているのか？ガチェックできるワークをしながら、お話しします

【いただいたご質問】
・強めに注意してしまった後の気持ちを切り替えるコツや、上手な声かけの工夫があれば知りたい
・自己肯定感を下げずにやってはいけないことを教える方法がわからない
・これからどんどん言葉が分かるようになっていく中で意識して関わるべきこと、やってはいけないことが知りたい
・毎日愛情を伝えるようにしているが、自分は無条件にみんなから愛される存在だと誤解してしまうのは避けたくて、加減や伝え方がこれで良いのか少し悩んでいる
・褒める時の声かけについて
・「すごい」「えらい」という褒め方について
・自己肯定感が高い子、低い子の特徴が知りたい","・結果を褒めるのではなく、その子本人を褒める。簡単なようで難しいです。でも意識して自己肯定感100の赤ちゃん、下げないように頑張りたいと思いました。
・1時間半あっという間に聴講させていただきました！（アーカイブです）
参加されていた方と同じで、私も結果ばかり褒めてしまっていたなと気付かされました。というか、薄々気づいていたんですがどう方向転換すればいいかわからなかったです。「本人を褒める」目から鱗でした👀✨そのためには本当に子供のことをよく観察しないといけないですね。安っぽい言葉かもしれませんが、「いいところ探し🔍」のように子供のことを見れたらいいなと思いました。
とはいえ、ずーっとそれだと「褒めるところ探さなきゃ🙄」と毛穴から出てきそうなので（笑）、まずは少しずつコツコツできたらいいなと思いました。これは本当に受けてよかったです！！今度はぜひリアルタイムでお話ししたいです！",https://fants.jp/feeds/888101?openExternalBrowser=1
心・からだ・知育のびのびコース,モリモリごはんクラス,ももマミー,もりもりごはんクラス　9月の質問回答ライブ,0～2歳,"【いただいたご質問】
・ｽﾌﾟｰﾝの持ち方
・早食い、詰め込み食い
・1歳児のお弁当について
・食べやすい卵料理レシピについて
・食への興味の持たせ方について
・スプーン練習について
・離乳食を始める前の準備について
・齧り取りメニューについて
・旅行(3泊4日)中の食事について
・幼児食のなかでも段階があるのでしょうか？いつ頃から大人と同じ食事を食べられるのでしょうか？
(そば、ナッツ等アレルギー反応の強いものや辛いもの等を除いて)いつまで大人の食事と作り分けないといけないのだろう‥と面倒に感じてしまっています‥
・母乳と粉ミルクの混合でやってきましたが、つい先日から乳首(母乳)を咥えてもすぐに離してしまい飲んでくれません。哺乳瓶はちゃんと咥えてしっかり飲んでいます。出来れば復職するまでのあと半年位は混合でと思っていたので、母乳も飲んでもらえるように何か出来る事はありますでしょうか。","・いつも丁寧な解説をありがとうございます。食が進まない件で今回も質問させていただきました。ふみおくんを紹介していただきましたが、確かに食事以外の何かで興味をひきながらの方がご飯を食べてくれる気がするので試してみようと思います。食事に集中させなきゃと思って色々排除することが正しいと思い込んでたので目からウロコでした。
そういえば私も幼少期は食が細く、よく麦茶でお腹いっぱいにして怒られていたなと思い出しました笑　変なところが似るものですね(^_^;)そんな私も今では立派に三度の飯とおやつが何より大好きな大人になりました‼︎
興味が無いものはしょうがないと割り切って気長に向き合って行こうと思います。",https://fants.jp/feeds/900101?openExternalBrowser=1
心・からだ・知育のびのびコース,発達あそびクラス,かなこ,体幹を育てる運動あそび,0～4歳,"思うように体を動かすには体幹は外せません。強い体幹を育てるには赤ちゃんからの発達を紐解いていく必要があります。
0歳からできる運動あそびをみんなやってみたいと思います！
3,4歳の大きな子も楽しめる内容にするので、是非ご兄弟でご参加下さい🎶

体幹を育てる運動あそび♪
○体幹って？背骨のS字カーブ、背骨の発達のお話
○絵本を用いた準備体操
○親子でできるおうち運動あそび
○幼児さんが楽しめる体幹を育てるための発展あそび
を行いました^^","・発達は子供それぞれですが親の少しの働きかけで発達を手助けできるということを学べてよかったです！気になっている反り返りについても運動して少しでもよくなってくれたら嬉しいです♥️
・娘がお昼寝中にアーカイブを拝見しました。お昼寝から起きたらできるように自分で動きをやってみたのですが大人がやっても気持ちよかったです。大人の真似っこをしたがる頃なので一緒に運動したいと思います。",https://fants.jp/feeds/903556?openExternalBrowser=1
心・からだ・知育のびのびコース,-,助産師あやの,比べない！ぶれない！ママの「自分軸」に作り方講座,0～6歳,"・SNSや周りと比べてモヤモヤしちゃうママ、自分らしい育児の「軸」を見つけていきましょう！
価値観をはっきりさせて、情報に振り回されないコツを知れば、イライラや迷いがぐっと減って、子どもを安心して見守れるようになります♪","・もともと自分軸が無い自信があったので、子供に対してはいつも肩に力が入ったままで、寝かしつけ後どっと疲れが出ていました。意外に簡単なステップで自分軸ができるならコツコツやってみようと思います。
SNSにも自分軸でソートできる機能があればいいのに‼︎
・優柔不断で他人の意見に流されやすく自己肯定感も低いです。毎日インスタで検索魔になっており、毎日もんもんとしていたと思います。今回、とてもシンプルで簡単にできそうなことばかり教えていただき、講座を聞いた日から実践できています。自分が信頼できる(取り入れたい)と思った方の情報だけ見ようというマインドに変わり、SNSで検索することも大幅に減りました。",https://fants.jp/feeds/905327?openExternalBrowser=1
心・からだ・知育のびのびコース,知育あそびクラス,ともか,洗濯バサミ,2～6歳,"お箸や鉛筆をゴールに行っている知育遊びクラスも折り返し！
いよいよ指先遊びも今まで以上にガッツリいきますよ。

家にある洗濯バサミでもこんなに遊べる✨
しっかり指先を使える筋力を鍛えながら
手と目の協応もより促していきましょう！","・指の発達のステップが説得力ありました。最近掴むからつまめるようになったので、これからよく注意して見ていきたいです。スライドもカラフルで見やすかったです。ともか先生はいつも講義のスピードや見やすさを気にしてくださっていてありがたいです。
・協力して動く、3本の指で、挟めているかがポイント。
サランラップやトイレットペーパーの芯に、洗濯ばさみをいれるあそびは、下の子にもできそうだと思いました。",https://fants.jp/feeds/918083?openExternalBrowser=1
心・からだ・知育のびのびコース,発達あそびクラス,かなこ,足が速くなるための運動あそび,0～6歳,"運動会シーズン。かけっこで一位をとりたい！少しでも早く走れるようになって欲しい。そう思っている親子さんもいるかと思います。
足を早くするためにはただ走るだけでなく、走るための動きの要素を一つ一つ積み上げていく必要があります。
なので0歳からでもできます。
もちろん大きい子が多ければよりダイナミックな内容にしますので、早くなるコツを知りたい！方は是非ご視聴ください✨

足が速くなる運動あそび♪
○走るために必要なことのお話
○絵本を用いた準備体操
○親子でできるおうち運動あそび
○幼児さんが楽しめる体幹を育てるための発展あそび
を行いました^^","・足は全身のかなめだなと思いました。
自宅ではジャンプできない環境ですが、お尻歩きなど、音が出ないものはやりたいです。
",https://fants.jp/feeds/925980?openExternalBrowser=1
心・からだ・知育のびのびコース,おうちモンテクラス,菅原りょうこ,"何ができるの？どういいの？
子どもを伸ばす【お手伝い】",0～6歳,"子どものお手伝いについてどう考えて、どうしていますか？
できることを増やしていくコツや子どもの成長に合わせたお手伝いの考え方をお話しします。

【いただいたご質問】
・お手伝いをどう誘えばいいのか、またどんなお手伝いを任せればいいのか基準がわからず悩んでいる
・お手伝いをどのように子どもにとらえてもらうのが良いのか悩んでいる。","・ちょうど上の子が、気分が乗ったときに「やりたい」というようになり、こちらも慌ててやれるようなことを用意しています。
賢い子はお手伝いをしているというのは理にかなっていると思いました。
・子どもに何を手伝わせるかよりも、お手伝いについて自分がどう考えるのか、自分の軸を持つ事が大切という事について、【お手伝い】だけに限らず子育て全てに通ずる考え方かと思いました。自分が小さい頃はお手伝いをほとんどしなかったので、同じように育った姉妹そろって家事が下手です。自分の娘にはそういった思いはさせたくないなと思いました。
りょうこ先生の5:30起きのお話とてもびっくりしたのですが、誰かの格言で印象に残っていた【大切な事は大体いつもめんどくさい】という言葉を思い出しました。",https://fants.jp/feeds/935913?openExternalBrowser=1
心・からだ・知育のびのびコース,おやこ英語クラス,MEInternational,Halloween,0～6歳,ハロウィンに関係する絵本や歌をご紹介します！,"・いろんなハロウィンの歌や絵本が見れて楽しかったです。普段聞き慣れない単語もあったりいつもと違う雰囲気でハロウィン気分を先取りできました(^^)
・子ども二人とアーカイブで視聴しました。
絵本のところは二人とも画面にくぎ付けになっていました。
アルファベットの学習のときに、画面共有されており、とても見やすかったです。",https://fants.jp/feeds/937058?openExternalBrowser=1
心・からだ・知育のびのびコース,モリモリごはんクラス,ももマミー,もりもりごはんクラス　ミニ講座【体調不良時の離乳食/幼児食のコツ】＆10月の質問回答ライブ,0～6歳,"季節の変わり目、寒くなると風邪も増えるのでそんな時のコツをお話

【いただいたご質問】
・お菓子の食べ過ぎについて
・ミルクの卒業の仕方について・寝る前のミルクに代わるものはどうすればいいか？
・朝食を食べてくれない
・鉄瓶の使用について
・授乳回数と離乳食の進め方について
・料理が苦手過ぎ、嫌い過ぎでご飯を作り続けるのが苦痛
・ミルク以外の飲み物について","・ちょうど下痢をしてるタイミングだったのでタイムリーでした。OS-1念のため常備してましたが、子どもに飲ませるのをちょっとためらっていたので、ちゃんとした正しい知識を教えてもらえて良かったです。賞味期限も確認しようと思います。
・今は子ども二人とも元気で過ごしていますが、インフルエンザが流行っているので、もしもの場合にどういう対処ができるか参考になりました。",https://fants.jp/feeds/937026?openExternalBrowser=1
心・からだ・知育のびのびコース,-,三橋かな,"\ママのしつけのせいじゃない/
生まれながらの子どもの気質を関わり方講座",0～6歳,"「どうしてうちの子だけ…」
「私の育て方が悪いの？」

そんな風に自分を責めてしまうママへ。

子どもには、生まれながらに持っている“気質”があります。
この講座では、しつけや育て方の問題ではなく、
子どもの個性（気質）に合わせた関わり方をお伝えします。

気質を知れば、子どもの困った行動が「なるほど！」に変わり、
ママ自身の心もぐっとラクになります。

✔ 怒っても変わらない子の対応に悩んでいる
✔ 下の子と上の子で正反対すぎて困っている
✔ 子どもの良さを伸ばしたいのに関わり方がわからない

そんな方にぴったりの内容です。
「うちの子ってこうだったんだ！」と腑に落ちる学びをお届けします。",・気質についてなんとなく生まれ持ったものはあるんだろうなーと思っていたものの、学術的にあるとは知らなくて興味深かったです。確かに傾向を知っておくと子育てが楽になりそうですね。私の子どもはどのタイプに属するかイマイチ判断できなかったので、質問回答会でお聞きしてみたいと思います。,https://fants.jp/feeds/938118?openExternalBrowser=1
心・からだ・知育のびのびコース,おやこ英語クラス,MEInternational,Animals,0～6歳,動物に関係する絵本や歌をたくさんご紹介します！,"・絵本をたくさん紹介してくださって楽しかったです。動物の絵とセットで英語が聞けると印象に残りますね。英語での動物の鳴き声もおもしろく親目線でも楽しめました。
・娘も途中まで一緒に見ました。動物に興味を持ち始めたところなので、タイムリーでした。手をたたいて喜んでました。
日本と外国の動物の鳴き声がこんなに違うのかと思いました。",https://fants.jp/feeds/957219?openExternalBrowser=1
